{
  "evidence_schema_version": "1.1.0",
  "recorded_at": "2026-10-08T02:13:25+00:00",
  "claim": "The local operations drill after the step 6 fixes: two processes on an isolated PostgreSQL with a real collector and Prometheus -- every scenario passes, every exercised alert fires and clears, every dashboard query runs, and no sentinel reaches telemetry, Prometheus or a log",
  "application": {
    "sha": "ed02e4f1449af39c97ba51151c060adc132d1e23",
    "tree": "0cfb92633ff21ecad07f5125317f23b3ba08d593",
    "branch": "codex/release-defects-oct06",
    "worktree_clean": true,
    "dirty_paths": [],
    "dirty_digests": null
  },
  "versions": {
    "metric_registry": "1.5.0",
    "metric_registry_digest": "0d7d9c41e3ad7392",
    "policy": "1.0.0",
    "schema_contract": "1.0.0",
    "mapping": "1.0.0",
    "classification_rules": "2.0.0",
    "prompt": "2.3.0",
    "planner": "2.1.0",
    "graph": "1.0.0",
    "suite": null,
    "oracle": null
  },
  "dataset": {
    "dataset_id": null,
    "load_mode": null,
    "fingerprint": null,
    "row_counts": null,
    "reporting_anchor": null,
    "database": "pac_drill (unreadable: PoolTimeout)"
  },
  "environment": {
    "provider_mode": "offline",
    "provider_model_id": null,
    "python": "3.13.2",
    "postgresql": "psql (PostgreSQL) 16.14 (Homebrew)",
    "os": "Darwin 25.2.0 arm64",
    "cpu_count": 10,
    "container": false,
    "notes": null
  },
  "command": {
    "argv": [
      "/Users/manideep/.venvs/pac-release/bin/python",
      "scripts/ops_drill.py",
      "--tools",
      "/Users/manideep/src/pac-work/tools",
      "--out",
      "/Users/manideep/src/pac-work/step6/r5-ops-drill-after.detail.json"
    ],
    "cwd_relative": ".",
    "env_overrides": null,
    "seed": null,
    "duration_s": 240.69
  },
  "outcome": {
    "status": "passed",
    "exit_code": 0,
    "counts": null,
    "blocked_reason": null,
    "summary": "drill: 13 passed, 0 failed -> /Users/manideep/src/pac-work/step6/r5-ops-drill-after.detail.json"
  },
  "artifacts": [],
  "limits": [
    "local evidence: one machine, one PostgreSQL cluster created for the drill, two processes not containers, shortened alert windows; not a hosted collector or backend, not an on-call incident drill, not a load test"
  ]
}
