{
  "evidence_schema_version": "1.0.0",
  "recorded_at": "2026-10-01T01:21:53+00:00",
  "claim": "A request reads the published generation and its facts under one repeatable-read snapshot and refuses with 'refresh' if a publication landed after planning; an older snapshot sees the old generation whole; a DELETE-based publication leaves readers answering (6.8 ms) where the old TRUNCATE held them until timeout (1573 ms). The review ledger: 0 reproduced, 20 fixed, 0 open.",
  "application": {
    "sha": "1718d29103def42fa1048ce2874ac38dc52f8423",
    "branch": "post-assessment/production-readiness",
    "worktree_clean": false,
    "dirty_paths": [
      ".github/workflows/ci.yml",
      "README.md",
      "app/conversation/runs.py",
      "app/data/loader.py",
      "app/db.py",
      "app/pipeline.py",
      "docs/API.md",
      "docs/REQUIREMENTS.md",
      "docs/RUNBOOK.md",
      "docs/TEST_INVENTORY.md",
      "evidence/probes/review_2026_09_30.py",
      "migrations/017_generation_marker.sql",
      "tests/security/test_snapshot_consistency.py",
      "web/src/App.jsx",
      "web/src/__tests__/conversation-contract.test.jsx"
    ]
  },
  "versions": {
    "metric_registry": "1.4.0",
    "metric_registry_digest": "5a39a26aaa68db9e",
    "policy": "1.0.0",
    "schema_contract": "1.0.0",
    "mapping": "1.0.0",
    "classification_rules": "1.0.0",
    "prompt": "2.0.0",
    "planner": "2.0.0",
    "graph": "1.0.0",
    "suite": null,
    "oracle": null
  },
  "dataset": {
    "dataset_id": "seed-d5e760711a5f",
    "load_mode": "seed",
    "fingerprint": "a29d02f0c9b24ea00e05f664",
    "row_counts": {
      "sales": 271,
      "users": 23,
      "products": 40,
      "organizations": 85,
      "zip_territory": 116
    },
    "reporting_anchor": {
      "max_mo": 6,
      "max_wk": 25,
      "min_mo": 0,
      "min_wk": 0,
      "max_txn": "2026-09-15",
      "max_period_mo": "2026-09",
      "max_period_qtr": "2026-Q3",
      "max_week_ending": "2026-09-20"
    },
    "database": "pharma_analytics_authtest"
  },
  "environment": {
    "provider_mode": "offline",
    "provider_model_id": null,
    "python": "3.13.2",
    "postgresql": "psql (PostgreSQL) 16.14 (Homebrew)",
    "os": "Darwin 25.2.0 arm64",
    "cpu_count": 10,
    "container": false,
    "notes": null
  },
  "command": {
    "argv": [
      "/Users/manideep/.venvs/pac/bin/python",
      "-m",
      "pytest",
      "tests/security/test_snapshot_consistency.py",
      "-q",
      "-p",
      "no:randomly"
    ],
    "cwd_relative": ".",
    "env_overrides": null,
    "seed": null,
    "duration_s": 2.51
  },
  "outcome": {
    "status": "passed",
    "exit_code": 0,
    "counts": {
      "passed": 5
    },
    "blocked_reason": null,
    "summary": "5 passed in 2.07s"
  },
  "artifacts": [],
  "limits": [
    "Reader latency measured on the seed-sized disposable database; the mechanism (MVCC) is size-independent, the full-dataset publication time was not re-measured.",
    "Vocabulary and entity indexes are read in earlier transactions; they are cached by generation and a mismatch is caught at execution, not prevented."
  ]
}
