{
  "evidence_schema_version": "1.0.0",
  "recorded_at": "2026-10-01T13:48:18+00:00",
  "claim": "Final head: the security suite under the strict release gate at its floor.",
  "application": {
    "sha": "12cecbe7c02b7462c840731f484289b612ba9096",
    "branch": "post-assessment/production-readiness",
    "worktree_clean": false,
    "dirty_paths": [
      "evidence/runs/r2-eval-final-holdout.json",
      "evidence/runs/r2-eval-final-holdout2.json",
      "evidence/runs/r2-eval-final-questions.json",
      "evidence/runs/r2-final-pytest.json",
      "evidence/runs/r2-ledger-final.json"
    ]
  },
  "versions": {
    "metric_registry": "1.4.0",
    "metric_registry_digest": "5a39a26aaa68db9e",
    "policy": "1.0.0",
    "schema_contract": "1.0.0",
    "mapping": "1.0.0",
    "classification_rules": "1.0.0",
    "prompt": "2.1.0",
    "planner": "2.0.0",
    "graph": "1.0.0",
    "suite": null,
    "oracle": null
  },
  "dataset": {
    "dataset_id": "seed-fae231f041e1",
    "load_mode": "seed",
    "fingerprint": "a29d02f0c9b24ea00e05f664",
    "row_counts": {
      "sales": 271,
      "users": 23,
      "products": 40,
      "organizations": 85,
      "zip_territory": 116
    },
    "reporting_anchor": {
      "max_mo": 6,
      "max_wk": 25,
      "min_mo": 0,
      "min_wk": 0,
      "max_txn": "2026-09-15",
      "max_period_mo": "2026-09",
      "max_period_qtr": "2026-Q3",
      "max_week_ending": "2026-09-20"
    },
    "database": "pharma_analytics_authtest"
  },
  "environment": {
    "provider_mode": "offline",
    "provider_model_id": null,
    "python": "3.13.2",
    "postgresql": "psql (PostgreSQL) 16.14 (Homebrew)",
    "os": "Darwin 25.2.0 arm64",
    "cpu_count": 10,
    "container": false,
    "notes": null
  },
  "command": {
    "argv": [
      "/Users/manideep/.venvs/pac/bin/python",
      "-m",
      "pytest",
      "tests/security",
      "-q",
      "-p",
      "no:randomly",
      "--release-gate",
      "--min-tests",
      "362"
    ],
    "cwd_relative": ".",
    "env_overrides": {
      "PAC_LLM_PROVIDER": "offline"
    },
    "seed": null,
    "duration_s": 23.53
  },
  "outcome": {
    "status": "passed",
    "exit_code": 0,
    "counts": {
      "passed": 362
    },
    "blocked_reason": null,
    "summary": "362 passed in 23.09s"
  },
  "artifacts": [],
  "limits": null
}
