{
  "evidence_schema_version": "1.1.0",
  "recorded_at": "2026-10-09T18:54:51+00:00",
  "claim": "The database security boundary is intact on the freshly provisioned release database",
  "application": {
    "sha": "2dfd2f1f01cc6ddcce7fdf053ca45f86af8ba259",
    "tree": "3cecc0b21f7cfedbc98951aab9b2de6ca2a08a7b",
    "branch": "codex/release-defects-oct06",
    "worktree_clean": true,
    "dirty_paths": [],
    "dirty_digests": null
  },
  "versions": {
    "metric_registry": "1.5.0",
    "metric_registry_digest": "0d7d9c41e3ad7392",
    "policy": "1.0.0",
    "schema_contract": "1.0.0",
    "mapping": "1.0.0",
    "classification_rules": "2.0.0",
    "prompt": "2.4.0",
    "planner": "2.1.0",
    "graph": "1.0.0",
    "suite": null,
    "oracle": null
  },
  "dataset": {
    "dataset_id": "full-c72d0262d47a",
    "load_mode": "full",
    "fingerprint": "1edc425858a2466a94d43657",
    "row_counts": {
      "sales": 2000000,
      "users": 23,
      "products": 40,
      "organizations": 40000,
      "zip_territory": 29728
    },
    "reporting_anchor": {
      "max_mo": 36,
      "max_wk": 155,
      "min_mo": 0,
      "min_wk": 0,
      "max_txn": "2026-09-18",
      "max_period_mo": "2026-09",
      "max_period_qtr": "2026-Q3",
      "max_week_ending": "2026-09-19"
    },
    "database": "pac_release"
  },
  "environment": {
    "provider_mode": "offline",
    "provider_model_id": null,
    "python": "3.13.2",
    "postgresql": "psql (PostgreSQL) 16.14 (Homebrew)",
    "os": "Darwin 25.2.0 arm64",
    "cpu_count": 10,
    "container": false,
    "notes": null
  },
  "command": {
    "argv": [
      "/Users/manideep/.venvs/pac-release/bin/python",
      "-c",
      "from app.db import verify_runtime_role_safety as v; p=v(); print(p or 'boundary intact'); raise SystemExit(1 if p else 0)"
    ],
    "cwd_relative": ".",
    "env_overrides": null,
    "seed": null,
    "duration_s": 0.16
  },
  "outcome": {
    "status": "passed",
    "exit_code": 0,
    "counts": null,
    "blocked_reason": null,
    "summary": "boundary intact"
  },
  "artifacts": [],
  "limits": null
}
