{
  "evidence_schema_version": "1.0.0",
  "recorded_at": "2026-10-01T13:45:20+00:00",
  "claim": "Offline evaluation set questions on the final branch head (deterministic planner; not a measure of natural-language accuracy).",
  "application": {
    "sha": "12cecbe7c02b7462c840731f484289b612ba9096",
    "branch": "post-assessment/production-readiness",
    "worktree_clean": false,
    "dirty_paths": [
      "evidence/runs/r2-ledger-final.json"
    ]
  },
  "versions": {
    "metric_registry": "1.4.0",
    "metric_registry_digest": "5a39a26aaa68db9e",
    "policy": "1.0.0",
    "schema_contract": "1.0.0",
    "mapping": "1.0.0",
    "classification_rules": "1.0.0",
    "prompt": "2.1.0",
    "planner": "2.0.0",
    "graph": "1.0.0",
    "suite": null,
    "oracle": null
  },
  "dataset": null,
  "environment": {
    "provider_mode": "offline",
    "provider_model_id": null,
    "python": "3.13.2",
    "postgresql": "psql (PostgreSQL) 16.14 (Homebrew)",
    "os": "Darwin 25.2.0 arm64",
    "cpu_count": 10,
    "container": false,
    "notes": null
  },
  "command": {
    "argv": [
      "/Users/manideep/.venvs/pac/bin/python",
      "scripts/run_evals.py",
      "--provider",
      "offline",
      "--questions",
      "evals/questions.yaml"
    ],
    "cwd_relative": ".",
    "env_overrides": {
      "PAC_LLM_PROVIDER": "offline"
    },
    "seed": null,
    "duration_s": 10.54
  },
  "outcome": {
    "status": "passed",
    "exit_code": 0,
    "counts": null,
    "blocked_reason": null,
    "summary": "  accuracy and must not be reported as one."
  },
  "artifacts": [],
  "limits": [
    "Offline planner only; live-model accuracy is not measured here."
  ]
}
