{
  "evidence_schema_version": "1.1.0",
  "recorded_at": "2026-10-07T16:05:39+00:00",
  "claim": "The browser journeys pass in real Chromium against a local server",
  "application": {
    "sha": "7950e71304ec1c6da7985f6fa9ec41a2b154da6f",
    "tree": "f9eaf48ad0180532f0c82ec7f6b8939e80125067",
    "branch": "codex/release-defects-oct06",
    "worktree_clean": true,
    "dirty_paths": [],
    "dirty_digests": null
  },
  "versions": {
    "metric_registry": "1.4.0",
    "metric_registry_digest": "5a39a26aaa68db9e",
    "policy": "1.0.0",
    "schema_contract": "1.0.0",
    "mapping": "1.0.0",
    "classification_rules": "1.0.0",
    "prompt": "2.1.0",
    "planner": "2.0.0",
    "graph": "1.0.0",
    "suite": null,
    "oracle": null
  },
  "dataset": {
    "dataset_id": "seed-fa99907f4fe9",
    "load_mode": "seed",
    "fingerprint": "a29d02f0c9b24ea00e05f664",
    "row_counts": {
      "sales": 271,
      "users": 23,
      "products": 40,
      "organizations": 85,
      "zip_territory": 116
    },
    "reporting_anchor": {
      "max_mo": 6,
      "max_wk": 25,
      "min_mo": 0,
      "min_wk": 0,
      "max_txn": "2026-09-15",
      "max_period_mo": "2026-09",
      "max_period_qtr": "2026-Q3",
      "max_week_ending": "2026-09-20"
    },
    "database": "pac_release_authtest"
  },
  "environment": {
    "provider_mode": "offline",
    "provider_model_id": null,
    "python": "3.13.2",
    "postgresql": "psql (PostgreSQL) 16.14 (Homebrew)",
    "os": "Darwin 25.2.0 arm64",
    "cpu_count": 10,
    "container": false,
    "notes": null
  },
  "command": {
    "argv": [
      "/Users/manideep/.venvs/pac-release/bin/python",
      "scripts/browser_journeys.py"
    ],
    "cwd_relative": ".",
    "env_overrides": null,
    "seed": null,
    "duration_s": 7.36
  },
  "outcome": {
    "status": "passed",
    "exit_code": 0,
    "counts": null,
    "blocked_reason": null,
    "summary": "  10 passed (4.9s)"
  },
  "artifacts": [],
  "limits": null
}
