{
  "evidence_schema_version": "1.1.0",
  "recorded_at": "2026-10-02T00:26:13+00:00",
  "claim": "Regression set, offline planner (a gate; not natural-language accuracy)",
  "application": {
    "sha": "45db088989153067cba6788572138713e8f7a3b4",
    "tree": "a7eabd8aa19f38aa8459c9fa9b7d52a3285eaede",
    "branch": "post-assessment/release-risks",
    "worktree_clean": true,
    "dirty_paths": [],
    "dirty_digests": null
  },
  "versions": {
    "metric_registry": "1.4.0",
    "metric_registry_digest": "5a39a26aaa68db9e",
    "policy": "1.0.0",
    "schema_contract": "1.0.0",
    "mapping": "1.0.0",
    "classification_rules": "1.0.0",
    "prompt": "2.1.0",
    "planner": "2.0.0",
    "graph": "1.0.0",
    "suite": null,
    "oracle": null
  },
  "dataset": {
    "dataset_id": "full-6f1f67b191f4",
    "load_mode": "full",
    "fingerprint": "cba52562c89a4f8fd76c52a3",
    "row_counts": {
      "sales": 2000000,
      "users": 23,
      "products": 40,
      "organizations": 40000,
      "zip_territory": 29728
    },
    "reporting_anchor": {
      "max_mo": 36,
      "max_wk": 155,
      "min_mo": 0,
      "min_wk": 0,
      "max_txn": "2026-09-18",
      "max_period_mo": "2026-09",
      "max_period_qtr": "2026-Q3",
      "max_week_ending": "2026-09-19"
    },
    "database": "pac_release"
  },
  "environment": {
    "provider_mode": "offline",
    "provider_model_id": null,
    "python": "3.13.2",
    "postgresql": "psql (PostgreSQL) 16.14 (Homebrew)",
    "os": "Darwin 25.2.0 arm64",
    "cpu_count": 10,
    "container": false,
    "notes": null
  },
  "command": {
    "argv": [
      "/Users/manideep/.venvs/pac-release/bin/python",
      "scripts/run_evals.py",
      "--provider",
      "offline",
      "--questions",
      "evals/questions.yaml"
    ],
    "cwd_relative": ".",
    "env_overrides": null,
    "seed": null,
    "duration_s": 8.48
  },
  "outcome": {
    "status": "passed",
    "exit_code": 0,
    "counts": null,
    "blocked_reason": null,
    "summary": "  accuracy and must not be reported as one."
  },
  "artifacts": [],
  "limits": null
}
