{
  "evidence_schema_version": "1.1.0",
  "recorded_at": "2026-10-07T21:53:36+00:00",
  "claim": "On unmodified code two processes export telemetry under identical resources (service.name, service.version only), so their cumulative series collide",
  "application": {
    "sha": "c2e5915f981f0e089be210e302623bd0f3f9f40a",
    "tree": "97ba90b63569c8d9a8eec5e53d91cda6fefec59a",
    "branch": "codex/release-defects-oct06",
    "worktree_clean": true,
    "dirty_paths": [],
    "dirty_digests": null
  },
  "versions": {
    "metric_registry": "1.5.0",
    "metric_registry_digest": "0d7d9c41e3ad7392",
    "policy": "1.0.0",
    "schema_contract": "1.0.0",
    "mapping": "1.0.0",
    "classification_rules": "2.0.0",
    "prompt": "2.3.0",
    "planner": "2.1.0",
    "graph": "1.0.0",
    "suite": null,
    "oracle": null
  },
  "dataset": {
    "dataset_id": null,
    "load_mode": null,
    "fingerprint": null,
    "row_counts": null,
    "reporting_anchor": null,
    "database": "none (unreadable: PoolTimeout)"
  },
  "environment": {
    "provider_mode": "offline",
    "provider_model_id": null,
    "python": "3.13.2",
    "postgresql": "psql (PostgreSQL) 16.14 (Homebrew)",
    "os": "Darwin 25.2.0 arm64",
    "cpu_count": 10,
    "container": false,
    "notes": null
  },
  "command": {
    "argv": [
      "/Users/manideep/.venvs/pac-release/bin/python",
      "-m",
      "pytest",
      "-q",
      "-p",
      "no:cacheprovider",
      "--runxfail",
      "tests/unit/test_telemetry_identity.py"
    ],
    "cwd_relative": ".",
    "env_overrides": null,
    "seed": null,
    "duration_s": 0.51
  },
  "outcome": {
    "status": "failed",
    "exit_code": 1,
    "counts": {
      "failed": 1
    },
    "blocked_reason": null,
    "summary": "1 failed in 0.23s"
  },
  "artifacts": [],
  "limits": null
}
