{
  "evidence_schema_version": "1.1.0",
  "recorded_at": "2026-10-08T08:31:14+00:00",
  "claim": "After 03316f3: CI's Full test suite step, as written, fails when the fixture-dependent tests skip on an empty fixture database, and passes on the real one",
  "application": {
    "sha": "03316f3acd02f98ffa076d11eada7d16f890d921",
    "tree": "94b54ec91b75fc1200b909ff5afc0a699c3c2ad7",
    "branch": "codex/release-defects-oct06",
    "worktree_clean": true,
    "dirty_paths": [],
    "dirty_digests": null
  },
  "versions": {
    "metric_registry": "1.5.0",
    "metric_registry_digest": "0d7d9c41e3ad7392",
    "policy": "1.0.0",
    "schema_contract": "1.0.0",
    "mapping": "1.0.0",
    "classification_rules": "2.0.0",
    "prompt": "2.3.0",
    "planner": "2.1.0",
    "graph": "1.0.0",
    "suite": null,
    "oracle": null
  },
  "dataset": null,
  "environment": {
    "provider_mode": "offline",
    "provider_model_id": null,
    "python": "3.13.2",
    "postgresql": "psql (PostgreSQL) 16.14 (Homebrew)",
    "os": "Darwin 25.2.0 arm64",
    "cpu_count": 10,
    "container": false,
    "notes": null
  },
  "command": {
    "argv": [
      "/Users/manideep/.venvs/pac-release/bin/python",
      "evidence/probes/ci_full_suite_gate.py"
    ],
    "cwd_relative": ".",
    "env_overrides": null,
    "seed": null,
    "duration_s": 1.08
  },
  "outcome": {
    "status": "passed",
    "exit_code": 0,
    "counts": null,
    "blocked_reason": null,
    "summary": "{\"step\": \"python -m pytest tests/integration/test_period_over_period_fixture.py -q --release-gate\", \"empty_fixture_db\": {\"exit\": 1, \"counts\": {\"error\": 7}}, \"with_fixture_db\": {\"exit\": 0, \"counts\": {\"passed\": 7}}, \"step_notices_skipped_tests\": true}"
  },
  "artifacts": [],
  "limits": [
    "the step's command run locally on one module; not a hosted CI run (pending authorization to push)"
  ]
}
