{
  "evidence_schema_version": "1.0.0",
  "recorded_at": "2026-10-01T01:07:41+00:00",
  "claim": "OpenID Connect sign-in (off by default) validates single-use state, PKCE S256, and the ID token's signature, algorithm, issuer, audience/azp, expiry and nonce through Authlib and joserfc; identities are keyed by (issuer, subject), never by email unless verified-email linking is enabled; the resulting session is the ordinary one.",
  "application": {
    "sha": "c100752544e9e6b5dec6edfb700c19b8dfe4b170",
    "branch": "post-assessment/production-readiness",
    "worktree_clean": false,
    "dirty_paths": [
      ".github/workflows/ci.yml",
      "README.md",
      "app/api/main.py",
      "app/auth/identity.py",
      "app/auth/oidc.py",
      "app/config.py",
      "docs/API.md",
      "docs/REQUIREMENTS.md",
      "docs/RUNBOOK.md",
      "docs/TEST_INVENTORY.md",
      "migrations/016_oidc.sql",
      "requirements.txt",
      "tests/security/test_oidc.py",
      "web/src/App.jsx",
      "web/src/__tests__/conversation-contract.test.jsx",
      "web/src/styles.css"
    ]
  },
  "versions": {
    "metric_registry": "1.4.0",
    "metric_registry_digest": "5a39a26aaa68db9e",
    "policy": "1.0.0",
    "schema_contract": "1.0.0",
    "mapping": "1.0.0",
    "classification_rules": "1.0.0",
    "prompt": "2.0.0",
    "planner": "2.0.0",
    "graph": "1.0.0",
    "suite": null,
    "oracle": null
  },
  "dataset": {
    "dataset_id": "seed-eefd935cbb10",
    "load_mode": "seed",
    "fingerprint": "a29d02f0c9b24ea00e05f664",
    "row_counts": {
      "sales": 271,
      "users": 23,
      "products": 40,
      "organizations": 85,
      "zip_territory": 116
    },
    "reporting_anchor": {
      "max_mo": 6,
      "max_wk": 25,
      "min_mo": 0,
      "min_wk": 0,
      "max_txn": "2026-09-15",
      "max_period_mo": "2026-09",
      "max_period_qtr": "2026-Q3",
      "max_week_ending": "2026-09-20"
    },
    "database": "pharma_analytics_authtest"
  },
  "environment": {
    "provider_mode": "offline",
    "provider_model_id": null,
    "python": "3.13.2",
    "postgresql": "psql (PostgreSQL) 16.14 (Homebrew)",
    "os": "Darwin 25.2.0 arm64",
    "cpu_count": 10,
    "container": false,
    "notes": null
  },
  "command": {
    "argv": [
      "/Users/manideep/.venvs/pac/bin/python",
      "-m",
      "pytest",
      "tests/security/test_oidc.py",
      "-q",
      "-p",
      "no:randomly"
    ],
    "cwd_relative": ".",
    "env_overrides": null,
    "seed": null,
    "duration_s": 2.16
  },
  "outcome": {
    "status": "passed",
    "exit_code": 0,
    "counts": {
      "passed": 19
    },
    "blocked_reason": null,
    "summary": "19 passed in 1.56s"
  },
  "artifacts": [],
  "limits": [
    "Against an in-process fake provider that enforces PKCE and signs real tokens; no commercial identity provider was registered or contacted.",
    "Enterprise MFA, account lifecycle and SCIM provisioning are the provider's and are not tested."
  ]
}
